{
  "version": 1,
  "customerId": "",
  "site": {
    "host": "192.168.0.151:3000"
  },
  "rules": [
    {
      "id": "rule-001",
      "selector": ".header p",
      "scope": {},
      "styles": {
        "fontSize": "40px",
        "color": "#ff0000",
        "textAlign": "left"
      },
      "classes": {
        "add": [],
        "remove": []
      },
      "attributes": {},
      "customCss": "",
      "enabled": true
    },
    {
      "id": "rule-002",
      "selector": ".box_title1",
      "scope": {},
      "styles": {
        "display": "none"
      },
      "classes": {
        "add": [],
        "remove": []
      },
      "attributes": {},
      "customCss": "",
      "enabled": true
    },
    {
      "id": "rule-003",
      "selector": ".box_text",
      "scope": {},
      "styles": {
        "color": "#fa0000",
        "textAlign": "center"
      },
      "classes": {
        "add": [],
        "remove": []
      },
      "attributes": {},
      "customCss": "",
      "enabled": true
    }
  ]
}